{
  "$schema": "../../schemas/acceptance.schema.json",
  "schema_version": 2,
  "phase_id": "00",
  "gate_id": "00-evidence-seal",
  "lineage_id": "00-evidence-seal-r0001",
  "disposition": "NOT_RUN",
  "disposition_detail": null,
  "manifest_sha256": null,
  "accepted_outputs": [],
  "accepted_by": null,
  "accepted_at": null
}
